{
  "$schema": "https://json-schema.org/draft/2020-12/schema",
  "$id": "https://harness-framework/schemas/stack.json",
  "title": "Stack",
  "description": "Describes the runtime-observable stack of a single project: languages, components (libraries/frameworks the project actually uses), and the canonical shapes of stdout lines those components emit. Produced by /detect-sensors as LLM-derived judgment from the project's manifests and initialization code; persisted at <project>/.harness/stack.json. Sensors authored against this project — particularly those with output: stream — derive execution.output_parsing.patterns[] from log_shapes[] rather than guessing. References: Boeckeler, 'Harness Engineering' (martinfowler.com); Lopopolo, 'Harness engineering: leveraging Codex…' (openai.com, 2026-02-11).",

  "$defs": {
    "Role": {
      "type": "string",
      "enum": [
        "http-server",
        "http-router",
        "http-middleware",
        "logger",
        "log-encoder",
        "tracer",
        "metrics",
        "queue-consumer",
        "queue-producer",
        "db-client",
        "rpc",
        "test-runner"
      ],
      "description": "Functional role this component plays. logger and log-encoder are split because the same logger (e.g. Zap) with different encoders (JSON vs console) produces different stdout shapes; the encoder is what determines the structured fields of the emitted lines."
    },

    "Format": {
      "type": "string",
      "enum": ["json", "logfmt", "plain", "stack-trace", "combined-log-format"],
      "description": "Wire format of stdout lines of this shape. json = single-line JSON object per line; logfmt = key=value k=v pairs per line; plain = unstructured human text; stack-trace = multi-line panic/exception trace (one Signal per trace, not per line); combined-log-format = Apache/Nginx-style positional access log."
    },

    "FieldMeaning": {
      "type": "string",
      "enum": [
        "severity",
        "message",
        "timestamp",
        "trace_id",
        "span_id",
        "status_code",
        "latency_ms",
        "method",
        "path",
        "user_id",
        "request_id",
        "service",
        "version",
        "other"
      ],
      "description": "Semantic role of the field, decoupled from its literal key. The same meaning may be expressed as 'level', 'severity', or 'lvl' across libraries — meaning=severity collapses them. Use 'other' as the escape hatch for project-specific fields that don't fit the canonical set."
    },

    "Evidence": {
      "type": "object",
      "additionalProperties": false,
      "required": ["file", "rationale"],
      "description": "Pointer back into the project source justifying a component or shape detection. Mirrors the shape of Signal.evidence so audit tooling can treat them uniformly.",
      "properties": {
        "file":       { "type": "string", "description": "Path relative to the project root." },
        "line_start": { "type": ["integer", "null"], "minimum": 1 },
        "line_end":   { "type": ["integer", "null"], "minimum": 1 },
        "rationale":  { "type": "string", "description": "One sentence on what this evidence proves." }
      }
    },

    "Field": {
      "type": "object",
      "additionalProperties": false,
      "required": ["key", "meaning"],
      "properties": {
        "key": {
          "type": "string",
          "description": "Literal field key in the log line, e.g. 'level', 'severity', 'ts', 'request_id', 'dd.trace_id'. The literal key is what regex patterns search for; meaning is the semantic label."
        },
        "meaning": { "$ref": "#/$defs/FieldMeaning" },
        "example_values": {
          "type": "array",
          "description": "Sample values observed or known to be emitted (e.g. ['DEBUG','INFO','WARN','ERROR'] for severity, ['/v1/charges'] for path). Optional but strongly recommended — these are the oracle values the regexes derived from this shape are expected to match, and seed test cases for those patterns. NOTE: 'calibration' is reserved in this codebase for the inferential-sensor sense (cost.tokens, confidence_threshold) — do not conflate.",
          "items": { "type": "string" }
        }
      }
    },

    "Component": {
      "type": "object",
      "additionalProperties": false,
      "required": ["role", "name", "evidence"],
      "properties": {
        "role": { "$ref": "#/$defs/Role" },
        "name": {
          "type": "string",
          "description": "Library import path or canonical name. Examples: 'go.uber.org/zap', 'pino', 'logback-classic', 'github.com/go-chi/chi/middleware', '@nestjs/common.Logger'."
        },
        "version": {
          "type": "string",
          "description": "SemVer when extractable from the manifest; free-form when the manifest doesn't pin (e.g. transitive dep, range)."
        },
        "config_summary": {
          "type": "string",
          "description": "One paragraph describing how this component is configured in the project, in enough detail that the LogShape it produces is unambiguous. Example: 'zap.NewProductionConfig() with EncoderConfig.LevelKey overridden to severity and TimeKey to ts_ms; sampling disabled.'"
        },
        "evidence": {
          "type": "array",
          "minItems": 1,
          "description": "Where in the source this component is initialized or configured. Multiple entries are fine when configuration is spread across files.",
          "items": { "$ref": "#/$defs/Evidence" }
        }
      }
    },

    "LogShape": {
      "type": "object",
      "additionalProperties": false,
      "required": ["id", "produced_by", "format", "sample"],
      "properties": {
        "id": {
          "type": "string",
          "pattern": "^[a-z][a-z0-9-]*$",
          "description": "Kebab-case slug unique within the stack. Examples: 'zap-prod-json', 'chi-access-log', 'panic-stack-trace', 'pino-default'."
        },
        "produced_by": {
          "type": "array",
          "minItems": 1,
          "description": "Names of Components (matching components[].name verbatim) that emit this shape. Multiple entries when the shape is a composition (e.g. middleware framing + structured logger payload).",
          "items": { "type": "string" }
        },
        "format": { "$ref": "#/$defs/Format" },
        "fields": {
          "type": "array",
          "description": "Structured fields present in this shape. REQUIRED in practice when format=json or format=logfmt — without it no regex can be derived; omitted for format=plain (no keys), format=stack-trace (positional), and format=combined-log-format (positional with implicit semantics).",
          "items": { "$ref": "#/$defs/Field" }
        },
        "severity_values": {
          "type": "array",
          "description": "When any fields[].meaning='severity', the literal values the project's severity field actually emits. Examples: Zap default => ['DEBUG','INFO','WARN','ERROR','DPANIC','PANIC','FATAL']; Pino numeric => ['10','20','30','40','50','60']. Consumers use this to map verdict ranges (e.g. ERROR/FATAL → fail, WARN → warn).",
          "items": { "type": "string" }
        },
        "sample": {
          "type": "string",
          "description": "One real example line of this shape, exactly as it would appear on stdout. Used as a golden reference: regex patterns drafted for this shape MUST match the sample. For format=stack-trace, may contain embedded newlines."
        }
      }
    }
  },

  "type": "object",
  "additionalProperties": false,
  "required": [
    "version",
    "detected_at",
    "detected_by",
    "languages",
    "components",
    "log_shapes"
  ],

  "properties": {
    "version": {
      "type": "string",
      "pattern": "^\\d+\\.\\d+\\.\\d+(-[A-Za-z0-9.-]+)?(\\+[A-Za-z0-9.-]+)?$",
      "description": "SemVer of this stack snapshot. Bump on contract changes (components added/removed, log_shapes restructured, severity_values changed)."
    },
    "detected_at": {
      "type": "string",
      "format": "date-time",
      "description": "ISO-8601 timestamp of when this stack was last generated."
    },
    "detected_by": {
      "type": "string",
      "description": "Identifier of the producer. For LLM-derived stacks, the model id (e.g. 'anthropic/claude-opus-4-7'). For hand-written stacks, 'manual'."
    },
    "languages": {
      "type": "array",
      "minItems": 1,
      "items": {
        "type": "object",
        "additionalProperties": false,
        "required": ["name"],
        "properties": {
          "name": {
            "type": "string",
            "description": "Canonical lowercase name. Examples: 'go', 'typescript', 'python', 'java', 'ruby', 'rust', 'kotlin', 'csharp'."
          },
          "version": {
            "type": "string",
            "description": "Version reported by the project's manifest (e.g. go.mod's 'go 1.25', package.json engines.node, pyproject's requires-python)."
          }
        }
      }
    },
    "components": {
      "type": "array",
      "minItems": 1,
      "items": { "$ref": "#/$defs/Component" }
    },
    "log_shapes": {
      "type": "array",
      "minItems": 1,
      "items": { "$ref": "#/$defs/LogShape" }
    }
  }
}
